Reddit Username,Number of Comments,Cumulative Comment Score,Top Comment Content
Vicous,2,11,"Agreed. Sure, some people have such an insufficient chemical balance and abnormal neural buildup in their brain, but there have been a good amount of people who have overcome depression- certainly not an easy feat nor did it just happen all so suddenly, but nonetheless they've overcome. Others still suffer from it but it's calmed enough to where they can put it in the back of their minds most of the time and live out normal lives as a result. 
 
 So I agree, it is dangerous to say that it's impossible to overcome depression, because it makes many lose hope or give up trying simply because it's ""accepted"" that depression will forever follow you. You can help it, but be prepared for a bumpy road, but if you got the will, you have the way."
Drumwin,2,11,"Fitter, happier?"
thevisceralpunch,2,11,Don't forget Hunting Bears and Pulk/Pull
hevilla14,2,11,"No problem, Pulk/Pull Revolving Doors."
yeabouai,2,11,mhm
These_Yogurtcloset,2,11,Saw this on their last tour and it had been my lock screen photo ever since
dapala1,2,11,"He's already considered a top movie composer in Hollywood and a top 5 guitarist of all time. He's getting the accolades he deserves, and that makes me sooooo happy. For him and humanity."
PickleDarling,2,10,Anyone just amazed at how they can still go in a direction that surprises us? This is as huge a shift for them as I think Kid A was.
EdwardBleed,2,10,FUCKFUCKFUCKFUCKFUCKFUCKFUCK
Otistetrax,2,10,Really? Sue you're not scaremongering?
sneakpeekbot,2,10,"**Here's a sneak peek of [/r/gatekeeping](https://np.reddit.com/r/gatekeeping) using the [top posts](https://np.reddit.com/r/gatekeeping/top/?sort=top&t=all) of all time!**
 
 \#1: [Jupiter storms](https://i.redd.it/kc1jrsxsk99y.jpg) | [295 comments](https://np.reddit.com/r/gatekeeping/comments/5nisqt/jupiter_storms/) 
 \#2: [Gatekeeper fails to gatekeep 1984](https://i.reddituploads.com/5b75dbefdde840a48ad8a06c016173f2?fit=max&h=1536&w=1536&s=52ef1cdbff50fcd3add76b1d4f9d92e3) | [274 comments](https://np.reddit.com/r/gatekeeping/comments/5fwbav/gatekeeper_fails_to_gatekeep_1984/) 
 \#3: [Getting fucked by a corporation makes me better](https://i.reddituploads.com/3cb8124a2986467fb4665eb8f38f5f71?fit=max&h=1536&w=1536&s=118f0037c14cc700747f2689a24961d8) | [707 comments](https://np.reddit.com/r/gatekeeping/comments/5wfc3w/getting_fucked_by_a_corporation_makes_me_better/)
 
 ----
 ^^I'm ^^a ^^bot, ^^beep ^^boop ^^| ^^Downvote ^^to ^^remove ^^| [^^Contact ^^me](https://www.reddit.com/message/compose/?to=sneakpeekbot) ^^| [^^Info](https://np.reddit.com/r/sneakpeekbot/) ^^| [^^Opt-out](https://np.reddit.com/r/sneakpeekbot/comments/5lveo6/blacklist/)"
Indriindri,2,10,I read this to the tune of Bodysnatchers.
SomethingAboutCamels,2,10,"At the end, I noticed when Thom is in the cave, with his creepy beyond the grave...warning, I see more of my face reflected in my tablet than I see of him. Intentional? I am hearing his...warning, and am forced to notice my face. 
 
 They know how most people see their videos. Is this them telling us to look at our piece in the destruction of the environment? In the video, Thom has already walked through all of us and has gone to ground. Then our own screens become mirrors..."
isiasob,2,10,"You need to do it on a browser. It's under ""community options"" just below the subscribe button."
correcthorsestapler,2,10,"I hear ""Power Rangers"" instead of ""The rain drops""."
Poobs678,2,10,"So I've been using Reddit via my phone, so i didn't get to add that little ""title"" next to my name, the ""ok not ok"" thingy. How do i do that?"
danklekandrey,2,10,The Bends will do the job
Wouldtick,2,10,Brilliant comment.
electricmaster23,2,9,The way that Thom's voice resonates alongside the strings is transcendent.
teddy-c,2,9,"The song is even better second time. The bass, oh God, the bass!"
dab10a,2,9,"This song fills me with the most intense existential dread . . . 
 
 
 . . . I love it."
WhenJokersAttack,2,9,"I have had it on repeat since hearing it, It's an incredible song. Prefer it to Burn The Witch."
rheadfuz,2,9,Anyone else reminded of Eternal Sunshine of Spotless Mind?
SiteSail,2,9,Did anyone else get some serious Frisson listening to this?
staythestranger,2,9,I'M NOT CRYING. YOU'RE CRYING
SagHor1,2,9,"I got Jonny and Thom's autograph during The Smile your when they were promoting ALFAA. 
 
 Jonny is definitely aging."
somanyroads,2,9,"I think he's suggesting that we shouldn't consider depression to be ""bad""...it's a normal human emotion, and it happens. You can't have happiness without sadness...you'd be in a vacuum."
_Keldt_,2,9,"Observation:
 
 > It looks like he's smiling and singing during every picture
 
 Condescension:
 
 > Like I understand that people want things in pictures but we also have these things called videos that can be much better for conveying information
 
 -
 
 > we have these things called videos
 
 This is criticism, sure, but if you want to be taken seriously you should try to criticize constructively. It's completely unnecessary to phrase your criticism in such a way that makes it seem like you think OP is an incompetent, inferior dolt."
sjwilli,2,9,I guffawed.
dejus,2,9,Not sure if joking. Have you heard John Mayer’s cover of Kid A?
nina00i,2,9,That isn't the whole magnificent quote.
Kendilious,2,9,I'm there with you for sure. That's putting radiohead's worst (imo) album against arguably Muse's best
StevenBeercockArt,2,9,"Saw yer, Thom!"
humanbastard2000,2,9,Wait is this real? !!
bolyosis,2,9,That was a great show. I caught both the Toronto and Montreal dates for that tour and for both shows rainbows actually appeared in the sky. Amazing.
moonpotatoes,2,9,It’s good but is it better than OKC? Some argue that In Rainbows is a throwback to OKC.
Benwey,2,8,"Yes he does not! His movies don't play in Israel...oh wait:
 
 http://www.jer-cin.org.il/en/event/6660"
DJmasterbear,2,8,I think he is playing a triangle through a bunch of pedals.
karmagod13000,2,8,i cant tell if this a joke or not
NonNewtonianFigs,2,8,Yes
xkittenpuncher,2,8,"House of Cards - rainy morning
 
 Weird fishes basemebt version - rainy evening
 
 Daydreaming- morning jam, the smell of fresh cut grass, the morning fog and dew, you're sitting on your porch with a cup of coffee and a cig. Fuckin perfect"
NATETRONICMC,2,8,"I think that thom hasn't aged as bad as people say but if he did decide to have his old hair style (like Johnny has kept his,) he wouldn't look like he aged as much. That picture couldnt look more accurate tho"
altsam19,2,8,"Everybody ages differently, and life experiences also ages up quick as hell. Look at Johnny Marr, he's aged good and normally, while Robert Smith aged insanely fast since the 2000s. Europeans in general age extremely fast."
Saint_Stephen420,2,8,I'd say that you just learn to live with it.
FuckyouAvast,2,8,"I don't think it's depressing at all. It may have been created in part by depressed musicians, but it doesn't make me feel depressed when I listen to it, ever."
bksbeat,2,8,You obviously haven’t heard Tiesto’s remix of [Street Spirit](https://youtu.be/YY-30pb8624)
paledragon64,2,8,"No problem, The Amazon Sounds of Orgy"
AltruisticPenguin,2,8,"I consider myself a Kanye fan and tlop was a decent album. However there was a thread on hhh which had leaked original tracks which Kanye changed a couple of weeks before release. In my opinion they blow the finished songs out of the water. I can pm you the thread if you want. It only has 4 or 5 songs from tlop, but it has other unreleased stuff which is fantastic."
yesitsmeow,2,8,So excited that you said “today” twice
bassthetic,2,8,amsp > okcomputer
HubristicSquid,2,8,I really like that you're counting Kid A and Amnesiac as one album! They were recorded together and I'm pretty sure they were supposed to be released together. The sound and tone of each of them both is so beautiful!
GrownKidsOfDrugLords,2,7,"No... This is about another seemingly modern and developed nation of white people (in the minds of the public) doing horrible things to the previous settlers of the land. It's not uncommon to find those speaking out against israel's persecution of Palestinians also speaking out against US occupation throughout the world. 
 
 Jews and the Jewish identity do need to be preserved and protected, but not at the expense of others' lives. That's just too crazy to think about when all of the Jewish and Israeli friends I have are some of the most thoughtful, kind, and generous people I've met. 
 
 Don't be like America. Don't mar the great nation you are building with the deaths and discrimination of untold millions."
Mitcheli1,2,7,"Beautiful track - one for the fans of the band. This will be on of those songs you play for your friend who ""likes radiohead"" because he listened to Karma Police a bunch back in the 90's and then tells you it sucks and its too depressing. JUST THE WAY I LIKE MY RADIOHEAD.
 
 I hope there's a good mix of uptempo vs downtempo tracks on this album."
kidofharith,2,7,"#Cryeerytime
 
 Seriously can't help it, I've listened maybe 20 times now and each time i've just lost my shit at about the 2 minute mark. 'This goes beyond me, beyond you' (cue uncontrollable weeping and laughing because I know how ridiculous I must look)"
peterampbell,2,7,"There's definitely guitar in this, it may be palm muted but it's there."
TheSimonToUrGarfunkl,2,7,"Good one, One Last Woohoo for the Pullman"
crasswriter,2,7,Had an *Amnesiac* feel to me.
Ridley413,2,7,This is beyond amazing... This song... Holy fuck!
WaltJizzney,2,7,God his whole outfit is Owens
ryancbeck777,2,7,thought he was wearing an UnderØath T shirt for a sec
onhalfaheart,2,7,"Throughout my time spent finally really listening to Radiohead (I put it off for a long time), I always thought Reckoner was really beautiful. And I'd find another song and really love it and play it to death but I'd always wind up back on Reckoner like ""yeah, this is probably just my favorite of theirs."""
Mumuuh91,2,7,To me its their most groovy and interesting work ever. Radiohead/ thom from 2006 to 2014/15 represents a more fascinating approach in developing fantastic songs in new interesting ways and not making it sound like just a good song. All their records are amazing though.
eddiegroon101,2,7,"if a\*b and b\*c, then a\*c."
pwppip,2,7,"I think this, AMA."
AJRiddle,2,7,Also the guitar techs tune them every time they swap a guitar/instrument out so they are getting tuned multiple times per show
3dg310rdd,2,7,"15 here (just gonna do top 3)
  1. in rainbows
  2. the bends
  3. ok computer"
lukestauntaun,2,7,42. In Rainbows. It's the stupid fish song that's got me eaten by the worm...
AySonny,2,7,Now that's Hall of Fame.
Eyeemef,2,6,It's actually about the media.
sciontis,2,6,"Not the best song they've done, definitely not the worst. The strings were the star and their performance was awe-inspiring. I always felt for a band that had someone as talented as Jonny, they tended towards restraint when using his talents. That might be their next direction, go full ""Ladies and Gentle We Are Floating in Space"" (look it up). Overall a worthy addition to their discography."
wtb2612,2,6,"There's also cover art on Spotify. Probably just for the single, but still cool."
SnowLeppard,2,6,THOM'S BASED
MojoPinnacle,2,6,"I'm not sure how to feel about it. It is definitely not as polarizing as ANYTHING on TKOL. I think for me I was expecting a bit more of an electronic focus, with the orchestra as a foil. I'm not sure about the balance b/w the raw percussive orchestra and the cheap drum machine sound (someone said it was 808?).
 
 Or maybe I was expecting less of a rock feel. I dunno.
 
 Either way I'm excited, and enjoyed this."
sonoftom,2,6,"Is this a Parks and Rec reference?
 
 edit: I'll answer my own question 
 
 https://www.youtube.com/watch?v=2jqKiVHS6x4"
collapse_turtle,2,6,why are you on r/radiohead then? lol
Think_please,2,6,I half expected him to end up in John Malkovich's head
WickedAndroid,2,6,"This slightly reminds me of motion picture soundtrack/ the kid a period. Great to see Thom and Jonny and the rest combine their geniusness again. Awesome song but i just wish the lyrics were a little bit more clearly hearable... This is not stopping all the ""buuuuueaheaheaaaaitch"" memes..."
peanutismint,2,6,Apparently Paul Thomas Anderson directed this. It kinda shows.
Madrical,2,6,Yeah I'd love to know the lyrics at the end there.
JGxFighterHayabusa,2,6,accurate. He’s a vampire guitar gawd
BiancaCarey,2,6,lol must be all his gymnast training from his youth
Vixalia,2,6,Any order is fine
gamedemon24,2,6,But in such a hilarious way
Dtruth333,2,6,"Well a diagnosis for acute Major Depressive Disorder is where over a two week period your functioning is affected more days than it is not. There is also Persistant Depressive Disorder which is more chronic. Both are real, and both can actually happen at the same time. Someone with Persistant can have major episodes and moderate or milder episodes. All of which are super fun for everyone yay!"
boatsnprose,2,6,"What about people with bipolar disorder or clinical depression? Yes, there is treatment. Yes, people should work towards getting better. But, no, it's probably not going to go away. Manic swings are the worst fucking thing because I know there's a deep pit to look forward to, and there's no positive thinking that's going to stop those chemicals from flooding my body. I can take medication, eat for my condition, and exercise mindfulness all I want, but I probably won't get rid of this disease. 
 
 And that's not an attack, excuse, or attempt at proving you wrong. I'm just saying there are lots of different types of depression. Knowing I'll never get rid of mine is fine, because I then am able to accept my problems and work towards managing them as best as I can. 
 
 Who knows. Maybe, with the right set of circumstances, the correct receptors in my brain will return to a normal level and I can finally feel 'normal'. It would be nice to be able to pull myself out of this condition permanently, but it's not something that can't be lived with.
 
 Sorry if this became a bit of an incoherent rant. My mind is all over the place right now."
FiddlesFromMyFingers,2,6,Punch Brothers' cover of Morning Bell?
kittyholiday,2,6,I love overalls. Utile so many pockets not tight around the waste. I just forget which pockets I put what in. That gets a little tiresome at times
kenalbert1997,2,6,and pablo honey is better than parachutes
PineapplesHit,2,6,"The only way that the strings extending past the nut (the part that separates the neck/fretboard from the headstock) would have any effect on sound is if you put enough pressure on them to bend them, which will make the pitch of the string higher. The strings extending past the nut don't actually make any sound/vibrate."
samdickwit,2,5,I am surprised no one is talking about it! A lot of holocaust-denying people involved with the BDS movement and people acting as if it was nothing.
_NerdKelly_,2,5,xx COMMENT OVERWRITTEN xx
the_luxio,2,5,"/r/streetwear noticed lol
 
 https://www.reddit.com/r/streetwear/comments/4i5ihk/thom_yorkes_fit_in_the_new_radiohead_vid_is/"
AutoMail_0,2,5,The Bands
JealousAd2873,2,5,Haircuts don't have an age limit.
Shipwrecking_siren,2,5,And the voodoo. Don’t forget that.
501down,2,5,out of all the songs i this album i’d second this
embarassingpjs,2,5,jesus christ he's faster than i thought he was
JustinHopewell,2,5,Or Godspeed You Black Emperor
josh_rose,2,5,"Hahaha. This is amazing. To be honesty, I would show up to a gig where Johnny just tunes guitars."
RedMollycules,2,5,Awwww. I love how he dresses. Look at those overalls.
RHCPandJF,2,5,Oh thanks
ssycophanticc,2,5,Busted.
ringdinger,2,5,7 and a half and amnesiac is my favorite
Johnest3181,2,5,Gotcha
DazedAmnesiac,2,5,24 and king of limbs is where it’s at
martha_buck,2,4,"Very well put, Thom"
lyricweaver,2,4,"This is what it's about! Art should break barriers and bring people together, not break them apart. I wish more artists felt this way and didn't pull out of performances because of political issues. The world is so much bigger than that. Politics come and go. People need awesome music, whether they live in a tough political climate or not."
gladvillain,2,4,DoppelThom!
fenix_funk,2,4,Yep. It's good.
WhatTheFhtagn,2,4,Yep
ohshroom,2,4,"Holy shit, it's a u/Fatalchemist sighting without anyone bringing up THE question. Are... are you okay?"
mb_mb_mb,2,4,those lyrics are a bit telling...I hope he's not unwell !!!!
Remarkable_Term3846,2,4,LOL kinda true
Constant_Stick1397,2,4,"I saw the Smile this year in June live and Thom looks his age, not older imo. Short hair and beard makes him look younger."
Wingedwing,2,4,"Bloom doesn’t feel like anxiety for me, I think it’s supposed to represent the beautiful controlled chaos of nature. The lyrics are far, far too ethereal and full of wonder to be anxious. 
 
 I can see feral being a bit nightmarish, but it’s just so darn groovy."
Cucumberside,2,4,"37
 
 1. Ok Computer
 2. Kid A
 3. The Bends
 4. In Rainbows
 5. Amnesiac
 6. Hail to the Thief
 7. King of Limbs
 8. Moon-Shaped Pool
 9. Pablo Honey"
niugnep24,2,4,"> I don't want people who are currently depressed to think that it's with them for life.
 
 It sometimes is, though. Chronic, clinical depression is a real thing, and some people never recover completely even with the best treatment.
 
 Some people even suffer from depression when every external factor says they shouldn't. People who are married with great families and awesome jobs and everything going for them in life can be clinically depressed. It's not a mindset, it's a disease."
spamshannon,2,4,please work as hard as you can to stay as happy as you can. im glad to hear things are brighter for you now.
icemankimi7,2,4,Where did that first clip come from? Lol
WooDadooDooRakeYohn,2,4,FAT
Spi00100,2,4,Awwwwww! :(
noxiclena,2,4,"Wait, I thought the Facebook radioheadmemes admin made this?"
windinmoscow,2,4,"I noticed everyone shares their opinions, so here’s mine:
 
 1. In Rainbows 
 2. Ok Computer
 3. Kid A"
ItzMarco,2,4,"Have we gotten to the point where In Rainbows' sheer quality has passed the combo of quality and cultural impact of OK Computer? Im not against it at all, but I'm starting to see in rainbows loved more and more."
fat_over_lean,2,4,"It's a good album but I think it brought in a very different crowd who prefer the more laid back Radiohead. Lots of younger people who got it for free, and In Rainbows was on repeat with college radio. Radiohead weren't really generating any new younger fans with Kid A, Amnesiac, or HTTT. Before In Rainbows most Radiohead fans were older and OKC/Kid A was all anyone fought about."
CoolHeadedLogician,2,4,"34, currently KID A"
toothsayur,2,4,I will never forget the first time I saw them at Bonnard 06. This song came. I wondered how he’d do it. Then he did this. I peaked.
Helacaster,2,3,Hell yeah. Im on a salad only 5 days a week diet for the last 3 months and i juat went to McDonald's yesterday while i was on the road and got a steak bagel. Dont regret that decision at all.
bulbousbouffant13,2,3,"Thanks, I just barfed a little. I am done with Reddit for the day."
Webo_,2,3,"Yeah because radiohead, one of the biggest bands in the world who are able to consistently fill stadiums and festivals, have less than 80,000 fans"
WombatWhisperer,2,3,they started flowing before he even started singing.... i've never experienced this from a single release before.
cheetahep,2,3,roflmao
hyperthermalreuinion,2,3,me irl
thirteenpunchman,2,3,"These are genuinely super, super cool, maybe my favorite artistic OC I've ever seen on this subreddit - I'd love to have seen some of these variants over the originals
 
 By album - 
 
 Pablo Honey: either OKC or AMSP
 
 The Bends: In Rainbows
 
 OK Computer: Kid A or TKOL
 
 Kid A: OKC or AMSP
 
 Amnesiac: In Rainbows or HTTT
 
 Hail to the Thief: Kid A or TKOL
 
 In Rainbows: AMSP or HTTT
 
 TKOL: AMSP
 
 AMSP: In Rainbows, OK Computer, The Bends
 
 seriously, these are very very cool"
stillinthesimulation,2,3,This is spectacular
in_rockfest,2,3,Thanks Thom for making me listen more since I have to figure out what you are saying clearly. Even with google search some lyrics sound wrong .
Kibubik,2,3,How was it quite clear?
polyethylene2,2,3,"Just read a lyric book, especially from The Bends through Amnesiac. His entire writing is littered with lyrics that are a sign of depression"
radioheadaddict,2,3,COOLEST post EVER!
LeurakGuayaba,2,3,"All I need from the basement, weird fishes, agh most of in rainbows."
Unstructional,2,3,"You did it, you fucking did it."
MorphineSmile,2,3,The one that goes “EEEEEEEEEEEEEEDDDD”
perfecttrapezoid,2,3,A Song of Ice (For My Drink)
InternalCatharsis,2,3,plus it's getting reissued on vinyl in august (or sometime around then) along with three other albums of his.
infantinemovie5,2,3,"That is a bold statement, and I whole heartedly disagree with it. Have an upvote."
Jrottin2,2,3,same
Squirrelmunk,2,3,"Aww, I thought it was real...."
ventraltegmental,2,3,"Damn. I was about to pull the trigger on tickets to see them tomorrow but now I'm like meh, seems kinda dickish how he talked to you"
turkey_of_spades,2,3,You're really out when you cut the string
Troaweymon42,2,3,"Payin attention, at attention?"
BeNbUcKToO,2,3,Thom is a prophet.
Nyffette,2,3,I have to boys (5 and 7). This one is closer to 3 IMO
loquaciousocean,2,3,SAME
DeadassYeeted,2,3,Amnesiac should be #8
DJ_Mbengas_Taco,2,2,/r/gatekeeping ?
assumeform,2,2,"These are honestly fabulous. Really good use of the iconic elements, mixing other official Radiohead art to create these as well was a really good move. The OKC in HTTT and TKOL... really fantastic. 
 
 &#x200B;
 
 Did you learn a lot over the summer doing this then?"
BuscoOpelCorsa,2,2,in the ok computer in amsp style is that thom's silhouette from Lotus flower videoclip?
Skelz0r-,2,2,I love this so fucking much.
RioVEVO,2,2,"I'm speechless, this is bloody incredible"
_PeopleMakeNoises_,2,2,A limb shaped pool actually looks good
andyiguess_19,2,2,i like the bends pablo honey
Arizonagreentea24-7,2,2,Does anyone have a video link to this?
fiddlepuss,2,2,all I can see is high tech computer jargon
Dukes_Up,2,2,Reminds me of that post where someone got the DJ to play Optimistic at their prom.
KorenKoren,2,2,It's probably Creep.
fairislander,2,2,I actually lobbied for my girl to be called Pearl...
ramen_samosa,2,2,"All of these make sense, except 15 step?"
regular_gonzalez,2,2,"I don't think that's what Reckoner is about at all. What it *is* about is much more depressing, haha."
MEEfO,2,2,Fucking cool. You and Thom both.
ilikejamescharles,2,2,u/Vredditdownloader
GuruFA5,2,2,"I did not know about this, thats pretty cool"
Cod4dropshotter,2,2,You mixed up okcomputer with amsp......
duke-love,2,2,Everyone is so young
mrkb34,2,2,It’s my favorite. But that’s a hard choice we all have to make. I’m 32.
Old_Bacon,2,2,"Same and then I’d basically be this exact list (I honestly can’t pick between Kid A, OKC and In rainbows tho)"
ocean365,2,1,Lmao
Dorramu,2,1,"This is the most incredible thing I’ve ever seen, you should definitely keep going on with ideas like this it’s so unique and you capture each albums feel so well. I can’t believe you’re not Tom Yorke"
jenjenbears11,2,1,"Yes, yes he is Scott"
ImThatCreep,2,-11,His expressions doesnt give much impression.
Synthzz,1,1117,HAPPENING STATUS: IT'S
Dave_Paker,1,1057,Weird Al is a vegan but plays at rib cookoffs
lvest,1,813,"This is my attempt at the lyrics. Some of it's kinda hard to hear.
 
 Stay in the shadows
 
 Cheer at the gallows
 
 This is a roundup
 
 This is a low flying panic attack
 
 Sing the song on the jukebox that goes
 
 
 Burn the witch x2
 
 We know where you live
 
 Red crosses on wooden doors
 
 And if you float you burn
 
 Loose talk around tables
 
 Abandon all reason
 
 Avoid all eye contact
 
 Do not react
 
 Shoot the messengers
 
 This is a low flying panic attack
 
 Sing the song of sixpence that goes
 
 
 Burn the witch x2
 
 We know where you live x2
 
 EDIT: Fixed some of the lyrics, thanks to /u/greazar!
 
 EDIT 2: Fixed some more"
DarkFlounder,1,690,Radiohead songs can be separated into two categories. ‘Creep’ and ‘other’.
cHicken04,1,688,NOT THE BEES!!!!!!!!!!!!!!!!!!
MCA2142,1,634,And not in maths.
DDF95,1,629,"r/radiohead just peaked. You can now close this subreddit, mods."
Iggythefool42,1,606,"No problem, let down"
Aggravating_Cup2306,1,584,so bold of him to expose the secret to immortality this early
Stereojunkie,1,572,"No problem, Kid A."
StreetBuddhist,1,518,I fucking love Thom Yorke
waxed__owl,1,497,...uuh guys did we back up the masters of the new album?
inhalingsounds,1,494,"I'm very, very happy to see that they went the orchestral way instead of the ever-growing idioteque way.
 
 Edit: what I mean is I hear a lot more Johnny Greenwood going on here (with his well-known influences from the big four of the minimalist movement - La Monte Young, Terry Riley, Philip Glass and particularly Steve Reich) than Thom Yorke's more electronic feel. Although I feel this will be far from their best track of the album, I think it's a perfect combo between both styles.
 
 Edit 2: When I say it's written in the ways of the old minimalist school, [I mean it](https://www.youtube.com/watch?v=zLckHHc25ww)."
bananasareyummy,1,491,"I guess daydreaming
 
 Also, SCROBBLES"
Bellamine_KidA,1,469,"""I hope that makes it CLEAR Ken"". OMG Thom is about to cure Ken's myxsomatosis"
