Reddit Username,Number of Comments,Cumulative Comment Score,Top Comment Content
creamisforreal,1,28,"supposed to be but i think it's infamous for never having ketchup (just like the ice-cream machine always being ""broke"") but who cares bc McDonalds is nasty"
Makins100,1,28,This is going to take a few more listens......
punchinface,1,28,British Summer Time
Moonalicious,1,28,i almost hope that's true
bluehairblondeeyes,1,28,It doesn't bother me I just don't go outside
nsilver3,1,28,We call him Richie for short
swyrl-,1,27,I sat through the whole thing waiting for it to get good
JagerBaBomb,1,27,That one's staying blue.
jona139,1,27,This is not what I expected after Burn the Witch but I'll take it. Beautiful song!
toshjhomson,1,27,"I think Thom has really grown into himself, he looks like an old Musical Sage now and I love it"
EverlongAutumn,1,27,thanks I hate it
OK_Android97,1,27,She’s running out the door
youlises95,1,27,">the beat forms a pyramid
 
 Go on..."
GirlsUsedToDissMe,1,27,into a lake and slowly sink vibe
BRLND,1,27,Look at all these scrobbles!
silverbowslumlord,1,27,"27, in rainbows"
WineGutter,1,26,"Fuck yes, Thom. People always shit all over artists who go to Israel. No matter what you think about the political situation over there, music is music. It should be enjoyed by everybody and most of the people in Israel and Palestine have absolutely no control over what their governments do. Music's for the people."
atomds,1,26,Not even a Radiohead fan but this is fucking awesome.
Bumaye94,1,26,"> Every person of liberal bent who suggests that Israel is the problem in the Middle East seems to have forgotten that there is only one country in the Middle East that actually has any sort of religious diversity in it. 
 
 While I agree with the general statement this point is pure bullshit. Assad might be among the worst people on the planet and most of his Generals deserve a trial in The Hague but when ISIS was marching on the Christian towns Qaryatayn, Mahin and Sadad they throw everything they had at them to save the Christians locals. You have Sunnis, Shias, Alawites, Yezidis, Druze and Christians (Armenians, Catholics, Syriac-Orthodox, Syriac-Maronite, etc.) all who have equal rights. There are many, many things wrong with the Baath Regime but that is one of the few points were they are rather decent. 
  
 Not to mention of course Lebanon which is even more religiously diverse or Iraqi Kurdistan where thousands in recent years converted to Christianity and Zoroastrianism and which started a huge vendetta against ISIS over the genocide against their Yezidi minority."
Dsands12,1,26,to the top of r/all we go!
_SpanishInquisition,1,26,"SCAREMONGERING STATUS:
 
 [ ] WE ARE
 
 [X] WE'RE NOT"
electroplankton,1,26,jontron came
cessna45,1,26,jobe also means persecuted in hebrew
sgtpjack,1,26,(Nice Dream)
myfriendthebean,1,26,Everyday we stray closer and closer to /r/radioheadcirclejerk
multiversechorus,1,26,Bullshit. I played in a band with Thim when I was 12 years old. He is still to this day a sweetheart. And a hell of a triangle player.
MasterBalls,1,25,Was so confused to see protestors at the Manchester gig. Why is there even a problem?
w00t4me,1,25,Radiohead confirmed for Burning Man at the trash fence!
idle_moose,1,25,"Does anyone have a mirror for Germany?
 
 Edit: [Their website](http://www.radiohead.com/deadairspace)"
JackyPotato,1,25,"Mi bebé tiene las curvas
 
 ¡Ay, papi!"
ManInCloak,1,25,Top contender for best post ever on r/radiohead
Bankster-,1,25,[Here](https://www.youtube.com/watch?v=q-Nymir3q34) is the regular version for anyone else from r/all who aren't familiar.
Favre99,1,24,Loving the strings in this song. Hope they're prominent in other songs on LP9.
MrFlowerpants,1,24,"I can't help but feel like this is alluding to nature and human impact in some way, especially from seeing the music video.
 
 edit1: Just wanted to add that it seems he's desperate to find nature again, something humans used to be a part of, but every time he opens a door he ends up in man-made structures. 
 edit2: [Genius](http://genius.com/Radiohead-daydreaming-lyrics) seems to say that it's ~~""Evol ym dnuof ev'I"" or ""I've found my love""~~ backwards. 
 edit3: It's changed to ""half of my life"" now."
DrDiamond7,1,24,this is the Skyrim intro of r/radiohead
hu3yf3llows,1,24,He must have an insanely high IQ
mike_gweeton,1,24,"20, OK computer hands down"
MrFoxLovesBoobafina,1,23,I'm mixed after first listen too. I didn't quite get that Radiohead feeling.
imnotavegetable,1,23,[relevant meme](http://68.media.tumblr.com/1ee4c1f44988e3ee34be742354fc0a0f/tumblr_op72vjnatI1rgfni8o1_1280.jpg)
mg33,1,23,I think that's what he meant though. Drums on BTW and not much on Daydreaming so somewhere between the two Phil lost his job.
Kelseycutieee,1,23,In Rainbows Thom would’ve still looked like In Rainbows Thom :(
malcolm_money,1,23,Thom: Ah shit here we go again.
magicjavelin,1,23,It reminds me of [this](https://www.youtube.com/watch?v=BI1GszLu0Ns).
edenshep5,1,23,/r/theonion
johnny_tapia,1,23,It's a wax statue of Thom.
Sutureupmyfuture82,1,23,I would lose my mind.
short_story_long_,1,23,"Yeah, I'm just not sure how we can say that it's better than OK Computer. I can understand the subjective argument about the music, but lyrically and thematically it's hard to argue against OK Computer, in my opinion. I guess the debate itself is a bit of the fun."
TheLonesomeBiscuit,1,23,Yeah but I think the point of in rainbows was to simplify the emotional potency of Radiohead in its most raw and exposed form without all the otherworldly sounds of kid a and okc.
SootAndStars,1,22,I just like seeing everyone who's coming from the front page who has never posted here and probably has never heard any Radiohead outside of Creep
Philanthropiss,1,22,"I dunno...
 
 This wasn't my cup of tea"
JadeRaven13,1,22,No I don't need any squids
netamerd,1,22,Radiohead.com
AtWorkAndOnReddit,1,22,With all this fire Radiohead is going to drop you can cook brunch right over the album.
Expert_Media2080,1,22,How dare he gets a wrinkle at 52!
Oxibase,1,22,The Amazing Sounds of Orgy really gets the party going.
robinlyon222,1,22,This made my day. And god damn EOB….
Radio_Ethiopia,1,22,Phil Selway already looked middle aged in 1993
santaist,1,21,"Very similar to this:
 
 http://archive.radiohead.com/Site11/"
Freddy_Bimmel,1,21,Or like Bubba from Forrest Gump listing all the shrimp recipes.
cutfingers,1,21,"This is one of the coolest things I’ve seen in a long time. Like, I want Thom and Stanley to see this."
D0MN8T0R,1,21,"It's pretty clear if you've ever seen that ""meeting people"" ok computer documentary"
cyclone_f5,1,21,No one else I know understands my love for Radiohead! You are my people!
PM-boobs-and-I-rate,1,21,"They've got some great parties in Alabama, I've heard. First one to catch covid wins!"
HunterIrked,1,21,The most Radiohead song title ever.
amart591,1,21,The opening to National Anthem always makes me feel like I'm watching a Cadillac commercial. Like I should be seeing a montage of the cars driving all cool and shit and then some gruff sounding voice over dude tells me about year end savings and 0% apr financing options. Or is that just me?
Blueshift_VII,1,21,Personally I like Muse's Origin of Symmetry better than TKOL (ok now everyone proceeds to downvote me for being a heathen)
grantster1998,1,21,"I CUT MY HAND OFF where I started,
 I CUT MY HAND OFF where I went wrong,
 Won't take my eyes off the ball again"
Expensive_Ad7661,1,21,Ed’ll have your eye out with his nip if you’re not careful
Admiringcone,1,20,I'm getting reaaaaal sick of these wankers trying to impose their opinions and beliefs on others. Fuck off.
hengehenge,1,20,What an odd video. The style is deliberately reminiscent of [Camberwick Green](http://youtu.be/bsqnzVZ_ASg) a British children's show from the 60s.
del_rio,1,20,FUCKING BEAUTIFUL SONG
rompope,1,20,It wears me out
directheated,1,20,"Please
 
 Someone just give this man a map of the building"
SamGamesPro,1,20,ALBUM RELEASED DIGITALLY ON MAY 8TH!!
Ckrius,1,20,There's an interesting book about this called So You've Been Publicly Shamed.
TheJollyLlama875,1,20,Does that mean they have to like it?
mr-flibble01,1,20,"You can like
 
 Go through them 
 
 And stuff"
suburban-errorist,1,20,"Karma police, arrest this man."
Khaoz77,1,19,Now I like Radiohead a bit more.
greg19735,1,19,"I have zero feelings toward radiohead, but i think it's a good response i hadn't really thought of before. Playing in your own country is not an endorsement of every shitty thing it has done. Why do we think that when artists play abroad? It's weird."
JRainers,1,19,"[Here you go, bud] (https://twitter.com/hilary_aked/status/883674858214883328?ref_src=twsrc%5Etfw&ref_url=https%3A%2F%2Fwww.alternativenation.net%2Fthom-yorke-flips-off-palestinian-protesters-at-radiohead-show-watch-epic-rant%2F)"
mattural,1,19,"You clearly have no understanding of the actual history in that area. Jews began immigrating to the area in the early 1900s from Europe. They bought land legally and lived there peacefully, for the most part. At that point Israel was actually under British control, Palestine didn't exist until after Israel. 
 
 On top of that, Israel originally agreed to a very generous 2 state solution but the Palestinians and other Arab neighbors refused to even consider it. They started, and lost, several wars with Israel leading to the current borders. Israel even gave back land that it won in those wars."
whangadude,1,19,I am all political on this blessed day
DoucheBaghdad,1,19,"*SCREAMS INTERNALLY*
 SCREAMS EXTERNALLY"
greekmatthew,1,19,ONTO LP10
Ghost00,1,19,"Fuck yeah!!!!!!! 
 
 Edit:Hold me!!!"
connorstory97,1,19,fuck living in that town
Ryzatron,1,19,Radiohead makes music for people with good taste.
Nickadial,1,19,i for one struggle with asking for extra ketchup at the drive-through when they give me two or three packets for my large fry
SleepingAntz,1,19,One of my first thoughts was about the ramones lol
angryman2,1,19,Hold me
Ryguypie1,1,19,I convinced my friend (a big Radiohead fan as well) to play Idioteque at a party once. He started dancing like Thom and everything. People were looking at him exactly like the people in this meme. Fun times
blitzkrieg4,1,19,"My favorite song title is ""The Shoes of the Fisherman's Wife Are Some Jive Ass Slippers"", though it isn't Sufjan."
Lightfail,1,19,"Reckoner always felt like acceptance to me, but like the type of acceptance you feel as a speeding train barreling towards you is 7 feet away and about to end it all."
wicklowdave,1,19,that's cool but did you tell him we said hi?
kratos649,1,19,49 and Kid A here
theleho,1,19,"The drummer for the band Half Moon Run does this too, you should check it out"
D35P07,1,18,"I think it's important to be understanding and supportive of the ideas behind the BDS movement, but Thom's right, it's unfair to the citizens of Israel to hold them collectively responsible for the long, violent history of their government."
Wild_Bob,1,18,"It's not even ""very wicker man"" it's literally a retelling of The Wicker Man with claymation. As a fan of older horror and especially The Wicker Man I starting grinning like an idiot when I realized what they were doing. Song is awesome too. 
 
 I am curious though as to why they added that final scene of the detective living, maybe there will be a continuation."
EtsuRah,1,18,It was a joke my friend.
g0cean3,1,18,I like this comment
koja1234,1,18,"Your post reached **top five in /r/all/rising**. The post was thus [x-posted](/r/Masub/comments/7ikxr3/accurate_rradiohead/) to /r/masub.
 
 It had 26 points ^(in 76 minutes) when the x-post was made."
tjc815,1,18,People have always been really weird about thom’s looks. It’s dumb
Zooropa_Station,1,18,"Yeah, it seems like Thom's misconstruing a dislike of depressing music (which is a valid opinion to have given music's subjectivity) with an attack or spurn of depression itself. Some people just like happy music."
PedroHhm,1,18,"I mean it’s kind of ambient song, so yeah you could play maybe like at the start of the party and it’d be normal"
lbrol,1,18,some boops tho.
GusHasGas,1,18,Of course it is..
mooxie,1,18,"Also I doubt that Radiohead is responsible for tuning their own instruments, so there would also be some dude in a baseball cap, jean shorts, and a t-shirt who probably looks distinctly different than Thom Yorke."
dokkodo_bubby,1,18,better than thom. but his dancing is inferior to thom's
observedlife,1,17,Speak for yourself
april9th,1,17,"> Israel is the only free country in the entire region.
 
 That's the same Israel that is annexing the West Bank and dropping white phosphorus on Gaza, which has cabinet members calling for the genocide of Arabs, others calling for the stripping of citizenship and deporting to the West Bank, which has something like 20% of the country non-Jews can't live on. All marriage is religious and the Rabbinate bans inter-religious marriage.
 
 foh with this totally bs concept of 'free'.
 
 Even if you take Freedom House's definition of freedom it isn't true - Tunisia is by their definition free, too."
Locoman_17,1,17,"Israelis do have claims to the land, israelites lived in the land of israel before the romans did and have lived there throughout history until they were kicked out by, you guessed it, the muslim conquerers.
 
 After being offered a fair peace 5 times palestine still declined, and people say palestine wants peace. Thats a load of shit"
Nonresemblance,1,17,"Jonny greenwood's Kalandar + Thom Yorke's Ballet = <3 
  
 EDIT: HOLY SHIT THIS IS HEAVEN. THAT MUSIC + PTA's GREAT CINEMATOGRAPHY 
  
 EDIT2: I have to be honest I am okayish on Burn the Witch but THIS IS ANOTHER LEVEL; TRACK + MUSIC VIDEO OF THE YEAARR!!!! 
  
 EDIT3: What's with the snoring at the end?! JK I'm loving the entirety of this and another shout out to Paul, he did this beautiful music justice.
  
 EDIT4: Guys do check out the subtleties and complexities of this track too, It seems like there a lot going on here. 
  
 EDIT5: All is good."
Gipito,1,17,"pitchfork did it he is saying ""half of my love"""
EGcia,1,17,OH NO
teethisland,1,17,"I genuinely think he looks hot af now that he's older, I don't know what that says about me and my taste in men"
sipofsoma,1,17,"I also suffer from depression, except for me Radiohead's music (and Thom's lyrics) are more empowering and uplifting rather than depressing. Imo, that's the main difference between being able to relate/empathize with ""depressing"" music and not being able to relate to it...it'll either bring you down or lift you up."
comiclover1377,1,17,"For some people definitely is. Chronic depression stays with you forever, medications help but they don't completely heal."
romiluss,1,17,"Well hate to be that guy, but it's a repost from @wish_i_was_amnesiac from instagram. but yeah"
TheLuciousBobbiDylan,1,17,Thank you. I had no idea either.
AntMan5421,1,17,The way the vocals transition from being in front of you to a voice behind you is just so beautiful
dogol__,1,17,very funny image that Thom hops between former British colonies constantly dressed like a lesbian.
TheRealSheikYerbouti,1,17,How to disappear completely
Noyanon,1,17,Reeeeeeeeeepost
RSollers,1,17,Thom liked to wear that *ANYWHHEEEERRRREEE!!!*
Roderick284,1,16,"Wow, and Ken Loach's film is playing at Tel Aviv right now...
 http://www.lev.co.il/movies"
BigBossN7,1,16,Nobody cares what you think asian incel.
gukeums1,1,16,aw man it's really cool to hear them sound like this
jo3,1,16,"where do you see that he escaped?
 
 Edit: GOT IT, THANKS EVERYONE"
_jamais_vu,1,16,"Couldn't agree more about the Steve Reich influence. That repetitive, propulsive, plucked sound - love it!"
squishypoo91,1,16,Just let it out. We all understand
Themiffins,1,16,No.
Theniceface,1,16,Anyone else get the feeling that the music (minus Thom's vocals) would fit well into the Interstellar score? God damn this song is beautiful!
braininabottle,1,16,"Ah yes the well known album, 'Hail To The Fief'"
HomelessTeletubby,1,16,"the long thin hair really does make him look like 15 years older, i imagine he’d look much younger with a kid a era cut"
AhoyPalloi,1,16,This account has been redacted due to Reddit's anti-user and anti-mod behavior. -- mass edited with redact.dev
Axetooth,1,16,"Ayy I'm seeing the flaming lips tonight
 
 EDIT: Holy *shit* that was a great show! The openers kicked ass too, I got a signed LP from them!"
beachvibing,1,16,Flexin' in that Undercover I c u Thommy boi
Alarming-Base-646,1,16,I met Colin at an airport on my way to see Radiohead. We were on the same damn plane but I was too nervous to say anything. By chance we were standing next to eachother again outside so I told him I was going to see Radiohead and he was so nice
gromoliii,1,16,They play in Quebec city on friday
Kingcrowing,1,16,"I think Thom loves MTL between Radiohead, The Smile, and Thom solo he plays a disproportionately high number of shows here."
armeef,1,16,"No, you're the one who MOST belongs here"
matiics,1,16,"By the transitive property, yup."
wlkingshdow,1,16,"Reading these comments, I had no idea I was so alone in my favourites. To me, top three would be AMSP, Amnesiac and Kid A and I honestly don’t even really understand what is it about OK Computer that people love so much."
blandsrules,1,16,Having Hail to the thief as number one is a symptom of myxomatosis
JetstreamSnake,1,15,Americans aren't building settlements on Canadian land
reallifepixel,1,15,"I was looking for a mention of Sun City in this thread thinking, ""Man, how is someone not referencing this?"" While performing in certain countries make not make them complicit to certain state-sanctioned policies, boycotting certain countries for their state-sanctioned policies does send a statement."
ramonycajones,1,15,"> Trump is having such a difficult beginning.
 
 Yeah, I'm sure he'll right the course any day now /s"
rhythmjones,1,15,"I gotta say, I liked this a lot. I mean, a *lot!* Probably the most excited I've been for a new Radiohead song since Paranoid Android. And that was 20 years ago.
 
 You can really hear Jonny's film score chops going on in the string parts (I presume he did the strings.) and the whole track is acoustic except for the bass. But it doesn't sound like an acoustic track AT ALL. 
 
 The only thing I didn't like were the vocals. The performance doesn't seem to have the same intensity as the instrumentals, and in the mix they are over compressed and sitting too much on top of the mix. 
 
 But overall, this is a great song and it speaks to the part of me that still misses OK Computer. It'll be interesting to hear what the rest of the album sounds like."
EnriqueSyrup,1,15,O fuk
mkc2020,1,15,"Hey man, to each their own but surely youtube quality is going to bottleneck any good headphones?
 
 I will admit though I can't afford to be an audiophile so i'm sure it works."
mappsy91,1,15,"that's what happened with King of limbs isn't it? Lotus Flower dropped early in the week then they just went fuck it, here's the album on friday"
szeredy,1,15,"attempt at the lyrics
 
 *dreamers*
 *they nev ..*.
 **HEAVY ORGASM EXPLODES EVERYTHING**"
pegasus_x,1,15,My body isn't ready for this
VintageOctopus,1,15,Agreed. These singles feel like they came from a more finished version of Hail to the Thief.
Joe_Henshell,1,15,No tenemos amigos reales
xDiam,1,15,It isn't.
dmo7000,1,15,Thom is aging for all of them. True mate.
bird_furniture,1,15,Damn you even put all the lyrics into the HTTT styles
Bhadgar,1,15,"I wouldn't call being ""down and depressed for about 5 years"" shallow or fake. That's pretty serious. It's definitely fair to say that it's different for everybody. Some people will never recover, some will. It depends on the person, the nature (and science) of their depression, their circumstances, and their life perspective."
taxmanmoney,1,15,there's a party in my head and no one is invited
double_positive,1,15,"""No problem,...You."""
shrugs27,1,15,that was absolutely AMAZING!!!
haken_loob,1,15,We got a New Yorker here!!
snoozieboi,1,15,"""climbing up the walls"" is described by Thom as one of his worst jobs as a painter because the owner of the house refused to provide proper scaffolding and as it was built on a sloping ground. Thom had to sneak in to reach the more complex places from he windows or resort to literally climb the external walls to reach everywhere . The song has been linked to an unsolved murder outside Oxford where a man was found battered with up to fifteen blows to the back of his head with an object covered in paint. 
 
 The murder was thought ho have happened On a Friday judging by how the external paint and the man found beside an open window had to be removed from the floor with the help of enormous amounts of paint thinner."
Severe_Doughnut5336,1,15,He was just kidding bro
cyaspy,1,15,I TRY TO SING ALONG BUT I GET IT ALL WRONG
thebeaverchair,1,15,34 and Hail to the Thief is my number one as well. Been a fan since I first heard Creep when I was 7 or 8.
Lateralus02,1,15,20 and this is my exact list
browngirls,1,14,"Way too many people these days see things in black and white extremes, me included. My guess is it's information overload + the internet connecting people in ways that let them create an echo chamber."
u_aintgottoliecraig,1,14,Aaaand that's why I love this guy (Thom). Classy response that gets the point across.
ohpee8,1,14,"And Trump gets away with everything, what's your point? If Obama did what trump is doing 4 years ago then the GOP would be flipping their shit. But nah they don't care. Trump gets away with way more shit."
summerlungs,1,14,WICKERMAN! Oh god damn feels so good when that synth bass drone and the drums start
davidlougheed,1,14,ｓａｒｃａｓｍ
Nwabudike_J_Morgan,1,14,"Images of pregnant women, women with strollers, album to be released on Mother's Day... the conclusion should be obvious:
 
 Radiohead is having a baby."
bunker_underground,1,14,"Oh, it's fucking gorgeous."
theydeletedme,1,14,The Bonds.
billytheskidd,1,14,Or redtube depending on what kinda drunk you are
juanseb1582,1,14,"While I do think A moon shaped pool in the style of King of limbs looks sick af... I don't think it fits the album well, AMSP is supposed to be peaceful and sad, the king of limbs style isnt giving me that as much as the original"
Im2FeetOffTheGround,1,14,"Never knew I needed to see thom run, so glad i did"
Meaning_Particular,1,14,"He also described it as their 'Transformer,' I think this sums it up better than his earlier quote."
sahand_n9,1,14,Bob Ross!
yellowhornet,1,14,It's one of those bot accounts that are trying to karma farm so that they can post their Temu links or whatever in the future. (Just look at their post and comment history.) Downvote and report it.
PM_GERMAN_SHEPHERDS,1,14,malnutrition
universal_ketchup,1,14,We have a winner for the best post I’ve ever seen on this sub.
TyeneSandSnake,1,14,We’re thirsty.
rezjeck,1,14,"It's my favorite album. So dynamic, so many different sounds between songs, Videotape is one of my top songs too."
2itay2,1,13,"Not a bad idea on papar, but in reality it's a HUGE security problem, especially when we had a long history with suicide bombings and terrorist attacks before the fence, also a literal terrorist organization is controlling a huge amount of Palestinians"
altalt2,1,13,ya we should clearly make robbery legal because it not murder.
AveryBeal,1,13,"It is propaganda bullshit to say those opposing Israels occupation of palestine are jew hating anti-semites. 
 
 Also the media covers Iran and Saudi a whole lot more than Israel. I mean we had sanctions on Iran that destroyed their economy."
George_Bellows,1,13,Is that the worst we've done? Maybe check how many recent conflicts that we have caused or old ones for that matter...
Exo-Genesis,1,13,"So a few years ago I tried listening to Radiohead for the first time. Tried out a couple of their slower songs, but wasn't feeling it too much.
 
 Then about a week ago, with all the hype going around, I decided to give them another chance. Now I've been listening to to ""Paranoid Android"", ""Myxomatosis"", ""2+2=5"", ""~~Electroengineering~~"" ""Electioneering"", ""Idioteque"", ""Pearly"", and a bunch of other great songs from Radiohead. 
 
 And now I get to add ""Burn the Witch"" to that collection!"
illegalblue,1,13,These strings are incredible. They've done it again!
ElectricAccordian,1,13,"Man I love Jonny. He’s been listening to a lot of Steve Reich lately, with the percussive, driving strings taking a page from Music For 18 Musicians. While that piece captures the dull throb of urban life in its monotony, “Burn The Witch” takes those themes and adds disconcerting color to them. That low synthesizer saws through the mix, sounding like an effect out of a horror movie, a ghost crying out for vengeance. The Reich homage is not accidental. Like the famous composer's piece, “Burn The Witch” concerns itself with the bland repetition of modern life, but tells us that our society is not just boring, there are sinister and dangerous elements flowing just underneath the surface."
applemaker123,1,13,the ending. jeeeezus christ. when they all turn and wave
sparrowhawk815,1,13,"First listen: this is really, really good
 
 Second listen: this is a masterpiece
 
 Third listen: i have died and been born again into the principle of continuous life"
Deadlyseriousness,1,13,HYPE IS BACK ON THE MENU BOYSSSSSSS
deekaydubya,1,13,"ah yes, but then you wouldn't get to relive the pre-streaming days of full youtube albums"
lfaire,1,13,this is true and thats exactly what makes this band great
