Reddit Username,Number of Comments,Cumulative Comment Score,Top Comment Content
somekidkatz,1,3,Thanks! Makes so much more sense now
CatsRats,1,3,SHIT HOLY
petepete16,1,3,A spooky ghost!
lastearthman,1,3,Colin's bass during the verse is very Airbag.
OnceWasABreadPan,1,3,"Lol I'm with you on this one, this sounds creepy as hell to me."
WiseauIsLife,1,3,Yes! Thank you so much - I knew the animation style looked so so familiar but I couldn't put my finger on it. I used to watch Camberwick Green when I was little but forgot what it was called.
mucking4on,1,3,"""maybe some ketchup would be nice. But I'll have to ask for it separately. What if they refuse. They probably won't. Them seem all right. But fries seem all right too. They'd probably taste better without ketchup. Of course they do. Ketchup would have ruined it for sure. Thank God I didn't get ketchup. It could have been an experiment, but I'm sure things are better off now. Maybe I should get some ketchup for the burger.. but I'll have to ask for it .........._"
glass-eyes,1,3,"I can't ask for ketchup at mcdonald's, when i can't even go to mcdonald's :'( ^(tho i don't really eat there) ^^which ^^makes ^^this ^^sadder"
USCGuayabapastelito,1,3,Drive through
ActionDonson,1,3,They're just poons.
Modest_Lion,1,3,Can't agree with this. Hail to the thief was my first favorite with the bends being a close second. Now it's kid a and in rainbows. But listening in chronological order is probably the best idea tho.
lebigmerm,1,3,This is how people get ptsd.
TheBrainwasher14,1,3,Good meme
RandomPerson9367,1,3,Ketchup with mayonnaisse actually tastes very good on pasta
ThisIsClarkKent,1,3,Doot doot
Gabrielle_Newell,1,3,I have seen you EVERYWHERE today
johnbhoy89,1,3,And fries
zeert,1,3,"I think it's more like... have anxiety, do the thing anyway. Know that the guy is gonna make fun of you for asking for ketchup. Feel like you're going to vomit asking for it. Feel that the world will end for having had this interaction. Get ketchup, world continues turning, consume with xanax."
SuperSonicSP,1,3,"Oh shit, is this the leaked LP10 sigle?"
Efficient-Ad-3249,1,3,"Yo, it’s been 4 years, if you haven’t done it can I have it. Bro I need to make this"
GRAIN_DIV_20,1,3,Oh shit waddup
TheEpicGhost,1,3,"This sounds like the album opener to me, very EIIRP style. BTW will probably somewhere in the middle since I don't think the two songs flow well into each other.
 
 Also it's lit af so thats good"
purpleslug,1,3,Words cannot describe how this has exploded my brain. I'm looking forward to their new album.
SterileCat,1,3,I fucking love this song. Absolutely beautiful.
autechrepeel,1,3,"i am almost crying, the warm parts"
paranoid_adamdroid,1,3,I've actually cried tears of joy. I'm such a girl.
zissoubisoubisou,1,3,This video brought to you by doors
zupzup19,1,3,Already one of my favorite Radiohead songs ever. Wow.
elpuxus,1,3,Final fantasy piano
DrunkVenusaur,1,3,Can I have sex with this song?
TazakiTsukuru,1,3,Holy shit PTA directed the video
EverydayPeoples,1,3,Thom Yorke is looking like Willie Nelson and Yoda had a baby.
foolishlyloaded,1,3,That was a real Twin Peaks ending.
DarkShadower,1,3,I feel like there's way way more to this video and song than I'm seeing/hearing.. and that's very exciting.
black-eyedangel,1,3,"This is simultaneously breaking and filling up my heart. Oh, Radiohead."
digitaldisorder21,1,3,Am i the only finding similarities between the end of this video and the Just video? My god why is it always so difficult to decipher the words of lying people.
drycloud,1,3,GOAT easily GOAT
ghostlypath,1,3,"And there we have it. May 8th. Thanks for all the memories guys. Sorry for all my ""it's out in January.... It's out in February... It's out in March... It's out in April..."" bullshit, I was just riding the hype train full pelt since Spectre came out. I love you all, and I can't wait to discuss every little detail of LP9 with you on Sunday. Peace x"
Rsebren,1,3,"This video is multiple lives in reverse. Its starts with walking into/out of a light at the end of the tunnel. 
 
 The doors are metaphors for decisions, multiple chapters of ones lives.
 
 The video ends with entering/exiting the womb. The worlds is dark and cold after leaving the warm embrace of the womb after awakening. 
 
 I absolutely love this approach."
Catherine_Mercury,1,3,I'm gonna nut
icrutonyou,1,3,"The moment the song picks up around 2:17 into this ""happy"" piano register and slowly falls back again into the overall tone of the song just reminds me of a lot in life right now. I want things to get better and they seem like they are for a brief moment in time and then I'm just back where I started. Defeated and slightly confused about life."
Perpetualllfear,1,3,"Is it me, or does thom never seem present in this video. It's like he goes into all of these different homes and environments but he never seems to really interact with any of it. The world around him is constantly out of focus. It really is such a beautiful video"
FugginIpad,1,3,"I put it on standing outside, watching the clouds roll over the mountain instead of the video. 
 
 I got a little choked up halfway through the first verse, then misty-eyed when those jolting strings come in. Those strings crush. They communicate a specific feeling so much stronger than other kinds of instruments. RH songs have always been about weaving a mood or emotion - they take it to the next level with this."
argiebhajji,1,3,"> The white room
 By window(?)
 
 So now the window tweet makes some sense, that was posted around when they did this video, no?"
MichiMitchelson,1,3,"I know, right? Man, I love Eternal Sunshine of the Spotless Mind, I was amazed watching the video."
jdlyons81,1,3,"I came too. Are......are we circle jerking? I mean, i'm ok with this buuuut, i dont wanna make YOU uncomfortabohhhhh there i go again."
arcticsandstorm,1,3,"For me it's mascara, glitter, tears and cum"
Soul_Immersed,1,3,"Love you. 
 
 Amazing song.
 
 Going to be an amazing album. Among their best if I had to guess."
Pop-X-,1,3,"Lets be honest with ourselves here — this subreddit made this album happen.
 
 Great job everyone, keep it up!"
AussieGrrrl,1,3,The tinkling piano gave me Sigur Ros vibes too :)
StructuralFailure,1,3,Yeah May 8th birthdays UNITE!
seluropnek,1,3,"""King of Limbs Part 2"""
Ouais,1,3,"I think the video represents his music entering so many places to help people cope with life. ""We are happy to serve."""
boxaccount,1,3,Probably using the whammy pedal to bend it down an octave or two at the end as well. I fucking love this song so much
montageofheck,1,3,"I always wished they used the Kaoss Pad on more songs. Such a cool vocal treatment, maybe we'll see it live?"
becauseinternets,1,3,"i'm a new mom- or, i will be on july 6 and this is the best first mother's day present EVER. SO EXCITED!"
Scal3s,1,3,"The distorted bit sounds more like ""What happens next"". The upwards inflection at the end sounds more like ""nuh"" going to ""ex"", instead of the normal downwards move from ""nuh"" to ""ow"""
Chamrox,1,3,Sounds like snoring that morphed into snore singing. Leave it to Radiohead to come up with snoresinging.
trippingbilly,1,3,"Well then, go to sleep."
jacklawtey,1,3,"You what pal?
 
 http://imgur.com/JQz8Lrv"
AnonymousSkull,1,3,"The very first time I heard Karma Police when I was a kid, I didn't get it and I thought it sounded depressing. I eventually got hooked to OK Computer, then became a huge fan. It took an open mind and some time."
Goodguystalker,1,3,They wouldn't be very good trap doors if you could see them
gmk3,1,3,"All week, I have loved going to bed thinking what wonderful new music will I wake up to tomorrow. Still in bed now and listening to Daydreaming for the second time over (the weird violin-like sounds at the five minute mark.. woah). Can't believe I'll have an album's worth of songs to listen to on Monday!!"
bennett_for_you,1,3,with burn the witch thats probably because it was written during the HTTT era.
quantum_overlord,1,3,"Yeah, I got that vibe too."
headphun,1,3,Don't bother with the people who aren't able to respect your opinion. I'm happy you have one and we both love Radiohead
cacahuate_,1,3,[Deleted]
ilisnf,1,3,Sheeeit. Ouch
nothief,1,3,Thank you for that belly laugh.
ThisIsMyNextUsername,1,3,They separated? Ow poor Thom :(
NewPony13,1,3,"Sulk = enfurruñarse
 
 (Apparently)"
mosquitoiv,1,3,Man never suffered twink death
garry_tash,1,3,"Well, it helps that you can’t see his face through all that hair"
imposgirl,1,3,"Thom is effin beautiful. He looks great. 
 
 Jonny looks great too."
roguepandaCO,1,3,Obvious vampire
LittleHeath,1,3,Ha leave it out you will get old mwhahahaaa!
NinJ4ng,1,3,gandthom? or thomgalf
rini6,1,3,It’s that jaw.
No-Year4653,1,3,Johnny looked like this when I saw the smile few months ago but u can clearly see he is aging from up close under the hair
arushmoregirl,1,3,Pretty sure he is an extraterrestrial
BettyG2424,1,3,Hahahahahhahagahaha…ha
evilClive21,1,3,"I saw Jonny in Hamburg this year, I was just walking home after the concert and out of the blue Jonny just walked right in front of me, before the security said I should move away, I got a glance at his terrified face, as if I would attack him.
 
 I think we both were equally shocked at each other and it was absolutely surreal seeing him and later thom in front of me... I guess I am taller than I thought :D"
6ix9ines-soap,1,3,"Thom Yorke really doesn't suit long hair, if he had it shorter he would look a lot more younger"
cleverusername2000,1,3,He is aging you just can never see his face cause of all the hair
wheresmydrink123,1,3,"I feel like if Thom and Robert Smith just dyed their hair to their natural color and got shorter cuts, it’d make them look 10 years younger. As much as I respect Robert’s undying loyalty to the goth look, the poorly applied makeup and wiry cloud of grey hair is definitely aging him"
Mauricio_ehpotatoman,1,3,He already masks it by using hair dyes lol
TheAmnesiacKid,1,3,That'd be enough to swear off chemicals for good. That's not saying anything about her voice... Just the bizarre experience of waking up to that in a daze.
filipebaldin,1,3,This is art
Mrjackh10,1,3,This is amazing
keepitlightand,1,3,"This is excellent. I especially love the TKOL and AMSP variations, but all are great. Well done!"
ValWenis,1,3,in rainbows in kotl style wow
Netescape,1,3,In Rainbows with Ok Computer style is powerful in strange ways
le_biffre,1,3,"I just spent a good 5 minutes looking through all of these album covers. I was in awe the whole time, these are amazing"
IsaactheSloth,1,3,"Oh my GOD the TKoL-style In Rainbows is so good... OP, could you link me to a high-res version of it?"
drydok,1,3,I’m seeing a lot of the kid a blips in here and I fkn love that
lackinganythingwise,1,3,"Obviously this is incredible, but to me the most impressive thing is the way you’ve captured the style of AMSP’s art, because some of those covers look uncannily like the art on the inside of the vinyl sleeve for AMSP, especially OKC!"
You-and-whose-Army,1,3,Amnesiac in the Bends style is awesome
smallstone,1,3,"Nice to see Claude Rajotte (the interviewer, on the left). He's basically the french-canadian John Peel and helped me develop my tastes in music since I was a teenager. He also did a lot of good Radiohead interviews."
Crazyplan9,1,3,is there a video for this?
hlokk101,1,3,"I find it depressing that so many people are averse to a) great music and b) anything other than positive emotions. 
 
 B is why every Hollywood film has to have a good ending, even when it's screamingly obvious that a different ending was required. 
 
 I assume these idiots are the same ones that always need to know what happened next and demand to see that the characters had good lives after the film's plot ended. No, stop. You don't need to know anything more than the director tells you. Films should all end like Robocop."
RaynSideways,1,3,"Maybe I'm a fanboy, but Radiohead's music has never seemed ""depressing"" to me. Most of the songs that I really love from them *drip* with emotion and sentiment. It's the kind of stuff I'd think I would listen to in order to *deal* with depression. Though, having never experienced it myself, I probably couldn't speak on that."
Mr_Grabby,1,3,Why I love thm
Afsprengi_Afla,1,3,"I guess some people think that depressed people need uplifting music and that listening to 'sad' music is a form of enabling the depressed person. There's also the huge problem many people have with what they call 'self-pity'. It's like a buzzword for when people are disgusted by something they perceive as weakness. A depressed person that suffers from shame, self-hatred and anguish is not being too soft on him/herself.
 
 Like they might think the lyrics to Let Down are self-pitying despondent drivel while from Thom's pov they're about having the courage to open up and discuss this mood and feelings.
 
 One more thing is that when depressed people listen to someone express their depression through music it can be life-affirming no matter how gloomy the lyrics may be. To the contrary: it can be taken as a sign that there are ways to confront these feelings, a way to endure, live through them and express them through art.
 
 I'd say that someone who can sing something like Videotape on stage and then smile to the audience isn't telling people to kill themselves but rather that they're not alone and someone can understand and respect them."
YouSeaBlue,1,3,"So many Radiohead songs make me cry. But it always feels so good. All of In Rainbows weighs heavy on my heart. I am convinced Daydreaming will play in my head when I die. Thom is right, it is a bonus.
 
 Sorry this is a little choppy. Kind of free flow thought. I'm pretty stoned."
khendar,1,3,"He has a point, but I still don't want to listen to depressing music."
DowagerCountess,1,3,Exactly...he really doesn't get it. I used to listen to radiohead a lot...but I was really depressed then.
inkybrown,1,3,"I thought his depression was well known. He even did a PSA a few years ago, maybe around 2010. It was featured on DAS. I think it was for Youth Health Talk, but on DAS you know on the left they used to write captions below, and I'm pretty sure I recall him writing something personal there below the link to the video. I can't find the archives for DAS though. The video refers to various types of health issues, but I distinctly recall the DAS verbiage mentioning depression.
 Here's the video: https://www.youtube.com/watch?v=K3lZ2cff02M
 
 UPDATE: Thank you, waybackmachine! I found the page from 2011. Below the link is written: ""depression is not fussy about who it hits. and feeling isolated and powerless doesnt help especially when yer young and all. this site has lots of people sharing their experiences which is what us humans need in order to cope."" So he didn't outright say he had depression, but to me what was written sounds like it is coming from someone who has firsthand experience with the disease and he was acknowledging kindred spirits on the website he did the PSA for..."
RadioDreadNYC,1,3,Well done
Belzebasss,1,3,U should give credits to the owner :(
gnarmilk,1,3,This actually happened to me but it was all I need
Rupert_Bimpy,1,3,"Accurate, except shuffle is on instead of repeat."
fcAVK,1,3,"Hopefully it’s not blasphemy to post a cover. I heard this the other day on kcrw and really enjoyed it.
 
 [Lianne La Havas; Weird Fishes](https://open.spotify.com/track/0pBPm7QxjaC46nlqQ4YNt8?si=oWzlvb9JRcuQlo4gRYy8Kg)"
vinylscar,1,3,Lmao
delynnium,1,3,Not at my party
slightlyworriedrobot,1,3,Nah everyone always throws down to pull/pulk
Kat8844,1,3,Should have gone with Videotape!.
CheeseWeegee,1,3,"HA, jokes on you, I'm too lonely to go to a party"
HuanTheMango,1,3,And can't forget treefingers
HereAndThereAndAway,1,3,This is beautiful. Thank you.
Finger_My_Chord,1,3,Put this on my gravestone
velociriptor,1,3,The memes that keep me coming back to this sub. This is the gold standard.
iamtaha96,1,3,It's so Buster Keaton like and i love it
donnyf68,1,3,Fake
Chilli_Axe,1,3,I heard the bit after “you’ll go to hell for what your dirty mind is thinking” from nude in my head
Stereopathetic_boyo,1,3,"Well if you include Karma Police, might as well add Exit Music and the entirety of The Bends excluding Bones"
punkdigerati,1,3,"Addendum, this is because before it was Last.Fm it was called audioscrobbler."
TheGruntingGoat,1,3,Yeah. I didn’t get the memo on that either!
FreshPimp,1,3,"No prob, Bangers & Mash!"
CtrlShiftAppoint,1,3,"No problem, there there"
Vecuronio,1,3,"You know, Kid A? You really messed up everything"
Tomusina,1,3,"When you keep your mind open to some of the crazy and extraordinary stuff that can be done with music, you can find music in the sound of a band tuning.
 
 I know, because I think about recording myself tune my guitar every time I'm stoned and jamming :3"
Ryanbonds1,1,3,"Well i mean for songs like Bodysnatchers or I might be wrong or even just which i think is a quarter step up, Jonny tunes it himself"
marc962,1,3,Is it a million on Reddit or across all social media platforms?
birdlover_,1,3,So jealous!!!
neon_nikedude,1,3,My God he's got overalls. How fucking gorgeous
omze,1,3,Was it today?
ResponsibleWest5240,1,3,Looks like he's making sure everything is in it's right place in the boutique. I'll see myself out.
BoltVase1357,1,3,He really is a hobbit
FancyFan4049,1,3,Thom is such a silly Yorke
gh0stlyy__,1,3,i love him so much
Gamesguy24,1,3,By met you meant stalking him
eosophobe,1,3,"I saw Thom Yorke in a grocery store in Los Angeles yesterday. I told him how cool it was to meet him in person, but I didn’t want to be a douche and bother him and ask him for photos or anything. 
 
 He said, “Oh, like you’re doing now?” 
 
 I was taken aback, and all I could say was “Huh?” but he kept cutting me off and going “huh? huh? huh?” and closing his hand shut in front of my face. I walked away and continued with my shopping, and I heard him chuckle as I walked off. When I came to pay for my stuff up front I saw Thom Yorke trying to walk out the doors with like fifteen Milky Ways in his hands without paying.
 
 The girl at the counter was very nice about it and professional, and was like “Sir, you need to pay for those first.” At first he kept pretending to be tired and not hear her, but eventually turned back around and brought them to the counter. 
 
 When she took one of the bars and started scanning it multiple times, he stopped her and told her to scan them each individually “to prevent any electrical infetterence,” and then turned around and winked at me. I don’t even think that’s a word. After she scanned each bar and put them in a bag and started to say the price, he kept interrupting her by yawning really loudly."
Jolly-Mycologist1141,1,3,🎶 I'm in the middle of your picture.... Montreal boutiqueee🎶🎶
Buck_Nastyyy,1,3,Instant d e a t h
Nick_VltorOfficial,1,3,What a lovely follow-up comment. Just tied a nice little bow on everything. Thank you.
alceria,1,3,This one weird trick signature scalpers don’t want you to know…
aBritishChap,1,3,Oh god the meme speaks too much truth
yflmd,1,3,What have you done????
Sciolent,1,3,"Same, I couldn't believe it was actually carbon monoxide :D"
syzygy14,1,3,"for too long I thought it was ""A restless man"""
kylank,1,3,Fuck I had to spit out my breakfast
Creeeeeeeam,1,3,"Whats with the pile-on everyone? Its a decent meme and OP didnt know it had been posted before.
 
 Seems ironic to say this to a bunch of Radiohead fans, but lighten up"
Fueryous,1,3,Fun fact : Radiohead was up for making the full soundtrack for Ice Age and even some members taking some minor voices in the movie. Even making the animal noises by mouth. Crazy right? Because it is. I'm spouting bullshit.
kiwipcbuilder,1,3,I've never seen this before and I've subscribed to this subreddit for years. This is the most hilarious thing I've seen on this sub in ages. Thanks.
DancinWithWolves,1,3,This is such a charming post. Thanks for sharing
Thin-Technician9509,1,3,holy SHIT. you were so insanely lucky!!!
subterralien_panda,1,3,So cool. And never realised how tall EOB is
Distinct-Ad4561,1,3,What a rarity! Thanks for sharing!
Believe-it-Geico,1,3,I'm on a roooooooooll
DrunkenAdama,1,3,In rainbows is 4th at best.
GwenZilly,1,3,How do you even pick a favorite? I'm so torn!
evensl,1,3,Kid A is not my favorite but I think it's their best album
Old_Breadbones,1,3,Kid A is my favorite album of all time and yet I find this 100% appropriate.
pumpyboi,1,3,22 AMSP
gooddarts,1,3,"Mid 30s, and I love OK Computer and KidA equally."
Thatantdog,1,3,17 and In Rainbows here
RaoulDuke44,1,3,"More accessible than OK Computer? That album put Radiohead on the map and is still their most popular and highest selling album to date by far. Not to mention you only ever hear Karma Police or Paranoid Android on the radio, both of which are off of OK."
Musehobo,1,3,"Only way I agree with this, and I kind of do, is because I consider IR Disc 2 as part of the first. Down is the New Up, 4 Minute Warning, and Last Flowers are amazing."
OakenBones,1,3,Yup “thoughts are misguided and a little naive” says right on the label here.
sean_the_emo,1,3,The bends is solid top 3 album for me
harvester_of_the_sea,1,3,"The bends (and especially the accompanying singles/ep's) shits all over TKOL.
 
  https://youtu.be/IHhCoGet1uY
 
 Also, HTTT > OK Computer all day long."
Avaiam,1,3,"41 and OK Computer (Kid A, The Bends, HTtT, In Rainbows, Amnesiac, TKoL, AMSP, ...................................,Pablo Honey)"
tveir,1,3,"29 and HTTT for me as well. It was the first album I ever bought, got it from CD Warehouse."
youhaveballs,1,3,51. I did exactly the same thing. And I wholeheartedly agree.
DealinCatnip,1,3,Same and same.
Donut,1,3,Geddy Lee sends his regards.
call_of_the_while,1,3,"Playing the keyboard with his guitar? Lol, that’s amazing."
blackcoffiend,1,3,Brian Cook plays bass and synth in Russian Circles and it rules.
fruit_shoot,1,2,KenLoachSixteen acting like he is 16
itachihappy,1,2,Fuck ya!!
BAGGET_FLENDER,1,2,Not only that but it is illegal to boycott Israel.
occamsshavingkit,1,2,"And if they're willing to pay $200+ a ticket, I'll play North Korea if they want me to."
jacount,1,2,how'd he write such a long tweet?
ReyTheRed,1,2,"Refusing to perform in a region is a fine political statement to make, but it isn't mandatory. Being political isn't mandatory, and if an artist does choose to make a political statement, there are a lot of ways to do it, most of them pretty good."
OnlyTheDead,1,2,Thom is 100% right here. The fatal idea that simply breaking everything into black and white while not engaging in dialogue with your opposition could be a viable solution for anything is insanity.
Comprehensive-Song51,1,2,Thom needs to have a long talk with Roger Waters. 🤣
checkmated6789,1,2,Fuck the BDS movement. Antisemitic douche bags
nicetryLaoChe,1,2,"thats so weird, Al"
porto1551,1,2,Well this is just sad.
EpicallyAverage,1,2,was going to up vote til I read your edit.
Deconstruct_You,1,2,Your attempted smear of Ken Loach is done by a deceptive technique called 'guilt by association' and also by creating a false equivalence between Radiohead playing a concert and Ken Loach going on a news channel.
General_Kamakaze,1,2,"Not all Israeli adults served in a combat unit in the IDF - about a quarter of potential conscripts are exempt for various reasons. Even then, not many units in the IDF are for combat; there are chefs, navigators, logistics corps etc.
 One can also do national service by volunteering in schools, hospitals, that sort of thing.
 And Israeli Arabs are exempt from national service (although some volunteer anyway)."
Imaginary_Hoodlum,1,2,"Isn't Thom a vegetarian? I know of interviews where he mentions this, but I don't know if he ever has said he's vegan."
OptimisticPyromaniac,1,2,I'm out of the loop with this GOOD point dialogue. Can someone fill me in?
mpyne,1,2,"I mean, the entire history of America is basically a long and undivided sequence of building settlements on indigenous land..."
SkollFenrirson,1,2,/r/FlashTV
Quatsch95,1,2,Like a deturned radio
KannyJumpy,1,2,Not in Putins Russia comrade.
deadlytrex,1,2,Breaking new ground every day.
paranormal_penguin,1,2,"> Israel is the only free country in the entire region.
 
 What are you smoking? Did you forget about Libya and Jordan? Hell, even Iran is getting pretty secular these days (by the Middle East's standards).
 
 Meanwhile we support Saudi Arabia, where most of the 9/11 attackers were from, and Israel, a first world country holding Palestinians hostage in third world conditions.
 
 It's not anti-semitism to have problems with Israel's actions, and it's both dismissive and non-constructive to throw out that accusation without good evidence. I am 100% of against illegal occupations and pseudo genocides. I'm just as against Israel's as I am against what the U.S. did in Guatemala. 
 
 It's obviously a complicated issue with many factors to consider, but calling any critics of Israel anti-semitic is a lazy and frankly offensive copout."
nxqv,1,2,Hahahahaha those last 20 or so seconds are gold. Thom at his Thommiest
Hideout_TheGreat,1,2,You might want to get that monitor changed. That can't be good for longevity.
ActivelyDrowsed,1,2,2.999... + 2.999... = 5
tehSlothman,1,2,"Lolol stupid people trying to make a change, if only they knew that everything's pointless because it doesn't work instantly they might be as enlightened as you are"
matiasgryn,1,2,When he lets his heart win
