Reddit Username,Number of Comments,Cumulative Comment Score,Top Comment Content
thefieryfistofpain,24,904,"tbh that isn’t me i’m the creep (no pun intended) behind the camera sneaking a pic cos he didn’t seem very keen on conversation or pictures. i knew if i didn’t take a pic no one would believe me so i had to lmao we basically brushed shoulders past each other and i approached him and said “excuse me are you Thom Yorke?” and he turns around, looks at me and goes “mhm” and that’s when this girl and another overheard me and started geeking, i gave him space and snagged a pic"
OneReportersOpinion,22,125,">And it's hard, because even if every anti-Israel post was entirely true, they would still be worth preserving and assisting. They are a bastion of freedom in the middle east. An oasis of education in the midst of ancient countries. They have one of the largest LGBT groups in Tel Aviv, and the country is the second most educated in the world. They have universal healthcare, which is more than the US can say. 
 
 Woah hold on. So you are saying that even if Israeli as committing a genocide of Palestine, they would be worth helping?
 
 Israel is a bastion of freedom of you are Jewish and/or a citizen of Israel. If you are one of 3 million plus Palestinians, you have no freedom. If you are one of the million plus Arab-Israelis, you face some serious discrimination. Palestinian don't get health care. They don't get to vote. They can however be jailed by Israel indefinitely without charge."
italox,16,174,"The guy could really hit those long, high notes with a lot of punch for a few years."
DLD493v3,15,165,"> had us do it in 4th grade
 
 That's some unfortunate phrasing."
99SoulsUp,13,617,"Jonny and Colin have definitely aged, they just age a bit slower and a bit better than average"
libelle156,13,109,"There was a interview where he talked about 'aging disgracefully' years ago, and yes, I think he was deliberate in it."
dieaana,13,19,"Thanks! 
 
 Us oldies we know. When Pablo Honey came out. We had not other Radiohead albums to compare with. It was a good album, still is."
jorriii,12,122,"""its about arpeggios""
 
 \-Jonny Greenwood"
machinich_phylum,12,45,Yikes. Is he aware of his own hypocrisy?
Tom-ocil,12,42,Dude it's a joke post with an old-lady-desk-calendar-grade analogy. And you're here telling people that hamburgers are bad for their health.
iscreamuscreamweall,11,173,That's actually only semi-true. I think thom or Jonny or ed debunked that one. It had more to do with touring logistics or something. I forget but maybe someone here remembers the interview
ThumYorky,10,1631,[me showing everyone the new song](http://i.imgur.com/s6KflQG.gifv)
taurus972,10,592,"This is probably going to get buried, but I'd like to say thanks to /r/radiohead for everything, the wild hype, the high (and low) quality news, the rampant speculation, even the memes. I'd like to say you guys helped me stay sane in these trying times but in all honesty, it was probably closer to the opposite.
 
 WE DID IT EVERYONE! MAY FUCKING 8!!!"
romanus666,10,277,"I found soooo much more videos of him jamming on Radiohead
 
 I could maybe post some more it this gets a lot of upvotes"
ohrightthatswhy,10,219,"To be honest I was dissapointed first listen. But it's because I was expecting to hear Thom's piano tinkling which doesn't make an appearance. I'm thinking it went a pulled apart by horses/Reckoner route.
 
 Second listen I started to dig it
 
 Third listen I fell head over heels in love"
itsyoboyy,10,14,Weird fishies is great. I will say that.
falcon_jab,9,295,ESPN Its Right Place
shoobsworth,9,41,"possibly, but not because of this.
 
 this actually isn't that big of a deal, though i can see how it is to people that don't play guitar."
Scott_96,9,19,I saw it and a Facebook group and thought you guys would enjoy it. I didn’t know it got reposted so much I’m sorry
15Dreams,8,824,The Body Issue would be a sick name for an album
k0stil,8,79,"Yeah, audiences could hear bands tuning back in the 60s-80s. Now it's unecessary because of tuning devices"
Rydiohead,8,20,Is In Rainbows really that good? I been a Radiohead fan for over 20 years.
identocidal,8,11,i agree with Thom
shirniaj,7,133,"Yes music is subjective but I am right and you are wrong, I hope this helps"
irisuniverse,7,126,"Ill Wind predicted Covid-19
 
 Change my mind."
marchbook,7,80,"I linked to [Loach's op-ed when it was published this morning](https://www.reddit.com/r/radiohead/comments/6mm7zm/ken_loach_in_the_independent_today_on_radiohead/?st=j4zq745w&sh=5f167042) in case anyone on the sub wanted to read it, but apparently the mods, for *some reason*, removed the post.
 
 It's Radiohead related, mods. You may not personally agree with Loach's politics or BDS, but the post shouldn't have been removed."
EatingCerealAt2AM,7,13,"""did you just say what i think you just said?"""
Sosolidclaws,6,2032,How nice of him to descend to the basic human level for the sake of our comprehension
RubberPlants,6,720,"[HQ gallery on imgur](https://imgur.com/gallery/E7yTTwI)
 
 I did the 72 album covers of every Radiohead album in every style. 
 It was a fun way to kill some time this summer and it made me appreciate the artwork much more. 
 I hope you like it. 
 If you know Stanley, spam him Jk!"
titomb345,6,165,So glad he brought up America and Trump.
tshirt_with_wolves,6,81,"Now that you’ve put it this way...this may be the best, most cohesive Radiohead album. HTTT is still may favourite though."
starman0305030,6,65,Don’t forget Treefingers
DOWNVOTEEEEEEEEEEEEE,6,27,"10 songs better than creep in no particular order
 1. karma police
 2. paranoid android
 3. weird fishes/ arpeggi
 4. nude
 5. jigsaw falling into place
 6. just
 7. black star
 8. fake plastic trees
 9. all i need
 10. 2+2=5
 I can think of a lot more, but can’t bother to type all of them"
2smashed4u,6,25,"As someone who has been extremely depressed and suicidal for a while now and have been waiting for LP9 very hard to take some of my attention away from that, the song fucking knocked me over like a goddamn bowling ball. Holy shit.
 
 This is one of the most beautiful and simultaneously gutwrenchingly painful songs/videos I've ever heard in my life. Just something about the words to this one, everything is extremely cathartic."
Serfi,6,24,"Nice story, and it’s cool that seeing the festival got to work out along with meeting some of the band. It reminds me of the Bowie song with the (quite literal) name of “Memory of a Free Festival”."
jdmercredi,6,23,"> except for the 40 hours/week I need to spend at work.
 
 that's pretty depressing ;)"
marlowgrey,6,8,"fat.
 
 ugly.
 
 ded."
tizzle_b_rizzle,5,317,One of the best I've seen of these
Gloomydoge,5,313,Aka “masterpiece” and “other”
SirNarwhal,5,218,This is way better than I could have ever imagined. The mix of the organic strings and the electronic drum hits is seriously amazing. They've done it again!
NipplesInAJar,5,193,"> Mi bebé tiene ~~las curvas~~ embolia gaseosa producida por una disminución brusca de la presión atmosférica
 
 FTFY"
MrMagpie,5,188,I was so hungry for more Ed after Spectre and BTW. I can hear him on BTW but it's mainly Jonny all over the place. This song made me tear up. I LOVE THIS BAND ADFKJADS;LFKJASDF
yearofourlordAD,5,171,Hail to the thief that stole ‘hail to the thief’ from top 3 Radiohead albums
ThomYorkeSucks,5,164,He's mad because Thom murdered his precious brit-pop
pm_me_china,5,143,Theim Yorke
Mysterions,5,100,"Palestinians aren't ""evil"". They are human being who have been continually booted out of their homes and oppressed over the last 70 years to make way for foreign settlers who claim the land on ethno-religious grounds. That some of them have resorted to violence is a manifestation of the effect not the cause. And regardless, it is not an excuse to wash an entire people as ""evil"". If it were you'd have to come to the same conclusion about Americans because our government mercilessly drone bombs villages in Pakistan. 
 
 I am obviously very much on Palestine's side in this issue, but I would never say that Israelis are evil either. The evil of an individual or an institution is not generalizable to the society."
goedegeit,5,98,"I think, using my amazing power of context, I can deduce that he's specifically talking about people who call his music bad and justify it with the fact that it's depressing."
kukheart,5,69,"I'm a high functioning autistic sociopath, so yeah. Works for me."
amsterdam_BTS,5,59,"""If you think this is over then you're wrong"" is about as close to a happy lyric as it is a threatening one, I suppose."
JobDestroyer,5,52,"Israel's policies toward the Palestinian people are, beyond a shadow of a doubt, absolutely evil. It is an apartheid happening there, and the danger and oppression faced by the Palestinians is simply horrifying. It is nothing short of a slow ethnic cleansing of the Palestinians.
 
 The fact that the United States government supports and is allied with the great evil that is the Israeli regime matches with their historic support of evil regimes of other stripes. 
 
 I guarantee that someone will call me an anti-semite for saying this, though. It's what the Israel lobby does."
InNoNeed,5,52,"False prophet in the sense that believing someone can save you. Like being depressed but falling in love and believing that being with that person can save you. It doesn't work out and you're back at the bottom. You could think of ""All I Need"" as the second part of ""Weird Fishes"" lyrically"
Iohet,5,45,"That's his perception. The way this sounds, he takes calling it depressing as an insult by rule. I call it depressing because it evokes emotional feelings of sadness and depression. I don't believe that this is an uncommon assessment. 
 
 The fact that he may or may not suffer from depression doesn't matter in this context despite his claim that it does, because people aren't personally dismissing him, rather making a statement that they do not enjoy the music because of the emotions it evokes. 
 
 Actually, it's interesting in a way, since it's not unheard of for depressed people to dislike that people around them aren't feeling that way and may want to bring people down to their level out of jealousy or spite or something else. Those people would take it personally that someone could dislike their music simply because of the emotion it evokes, and, more importantly, that they would not want to experience the specific depression and sadness the song evokes."
greensthecolor,5,44,"I’m 5’5 and 1/2 and I seemed to be right at his level. Jonny was huge! He shook my hand and it disappeared. Massive mitts on that one, as you can see when you watch him play guitars."
Bl4Z3D_d0Nut311,5,36,Sounded like Pulk/Pull to me
Scared_Wrongdoer_486,5,35,Always had
Minusguy,5,31,"It sounds like you're from Russia. I can relate.
 
 I have pretty severe mental issues along with depression (genetical too) and I'm very well aware of them. The problem is that I need a psychologist, not a psychiatrist. Psychiatry is the default way of treating mental illnesses in Russia and it's absolutely gruesome. It's the Soviet way. CBT is what I'd like to try. But you're right, it's extremely expensive, not available in free institutions. 
 
 As for the stigma, it really depends on your condition. Diagnoses like depression, depersonalization or cyclothymia won't reduce your chances to get a good job. Bipolar is harder, it should be controlled very well in order for you to get a good job or driver's license. Schizophrenia is a big no-no and ruined life obviously."
caitsith01,5,28,How old are you? I was 16 when OK Computer came out and it's hard to explain how fundamentally that album changed the way music sounded. But in 2020 it doesn't sound as revolutionary because it basically inspired half the alternative/indie music of the next couple of decades.
marshsmellow,5,24,You shut your whore mouth!
mazzysturr,5,21,Saw Radiohead once in MTL outside on their In Rainbows tour; insane show.
TheHeroicOnion,5,19,Finally I'm free of all the weight I've been carrying
giblber,5,15,"You can have it, here: [https://gph.is/g/aQNMgmk](https://gph.is/g/aQNMgmk)"
AndroidParanoidOk,5,14,Did she tell him to put everything in it's right place?
johnhk4,5,10,"17 yrs old. Smoking my first cigarette and my cousin puts on Everything in its Right Place via a CD player with a cassette tape adapter in his green Jeep Cherokee with a vanilla Christmas tree car freshener, going 60mph down a backroad on a frigid day in late spring of 2002 in the woods of Suffolk County, Long Island NY."
imalloutofclever,5,8,I don't know I'd rather listen to an award-winning guy who's is a freaking genius that makes music in his underwear. I don't really care how he makes music. And I'm here defending his overalls because he is genuine and kind to his fans. Also while in his overalls. A really good nice guy. And I love him for that.
con4cyn,5,6,"Ugh I hate rankings! 
 I’m 38
 1) Kid A
 2) OK Computer
 3) In Rainbows
 4) Hail to the Thief
 5) Amnesiac
 6) The Bends ??
 7) A Moon Shaped Pool ??
 8) King of Limbs
 9) Pablo Honey"
guitarmaniac004,4,861,"They're not mad because you're playing radiohead, it's because you left the album on shuffle smh"
dvstec,4,772,:)
m0nky,4,557,when did In Rainbows become the consensus favourite?
Lotuseaterlimbo,4,433,Fstr Jnn - Thm
InRainbows123207,4,432,You asked Thom if he was Thom when you knew it was Thom? 😂
hoopstick,4,334,I'd like to see a breakdown of how users age reflects their favorite album.
Royskatt,4,327,"Finally a response I can get behind. The last time Thom tried to speak about the subject, it was quite clumsy to say the least, but this is a professional and polite response. I still don't completely agree with this, but I feel more comfortable about it now."
DoutFooL,4,256,http://i.imgur.com/TUhyNy8.gifv
supercollander,4,255,"guys there are subtle binaural textures in Daydreaming. 
 
 this sounds like Kid A's title song successor
 
 i'm fucking so emotional right now
 
 2 full days til 7pm BST/2pm EST. TWO. DAYS. AFTER ALL THOSE SHITPOSTS AND LAUGHS AND SPECULATION. It's been one of the most memorable parts of my life and i'd like to thank this subreddit deeply."
brutinator,4,235,"Ironically, at an inter-sectional lgbt march, a woman, a lesbian one, got kicked out due to flying a rainbow flag with a star of david on it. Not in support of Isreal, but simply because she was jewish, and it was a big part of her identity. Didn't matter, kicked out. She wrote a whole article in the NYT. Very interesting stuff."
loolajeppe,4,235,"Since /u/hiplink only was half helpful, the bands name is Radiohead!"
originalwombat1,4,228,Not naming names but one or two of these better the originals
dmrsk,4,169,"Yes, it often happens."
ClocktowerMaria,4,168,If your dad if a Sufjan fan it gets a lot worse y'know
acmercer,4,138,"Well I'm a 33 year-old male with no kids, but... best Mother's Day gift **EVER**"
_soundshapes,4,137,Feral is the party track
Fanchus,4,130,Please tell me you have an Instagram or something we can follow for more art
Themrhalo3freak,4,129,11 AM PST SUNDAY
sfsdfd,4,119,"I experience depression as well, and I think that his remarks are misplaced.
 
 ""Radiohead's music is depressing"" has nothing to do with clinical depression, and it doesn't suggest any characterization of people who suffer from the condition of depression. It simply means: ""This music makes me sad.""
 
 I'm glad that Yorke is talking publicly about clinical depression - he's correct that it is a subject that needs more awareness and less stigma - but attaching those remarks to this comment is... not really accurate."
kellyhitchcock,4,110,"I have identical twins and before/when they are born, they are identified as ""Baby A"" and ""Baby B"". For that reason, we call them Kid A and Kid B pretty often. I would think onesies to that effect would exist, but so far as I can tell they do not.
 
 Same with onesies that say ""Cut the kids in half"" though I suspect the general public might not get it."
WRONGFUL_BONER,4,101,It's very Boards of Canada-y
kidamnesiac24,4,94,"Gotta love some Sufjan. Acronyms are fun. 
 
 TBHWOHTDAECASFGAYITMOWAFTIBYGTHTLNOIHFTBKAWCTFTUTAOOL"
PermanentStarlight,4,87,I hear Ed all over this track!
CUM_AT_ME_BRAH,4,86,"It’s more accessible, an easier listen, more radio friendly ect. It makes sense that it would be more people’s favorites. The argument if it is a BETTER album is one entirely different from it being everyone’s favorite.
 
 FWIW, it’s my favorite as well, but more likely because I was 15 when it came out and it just hit that groove of attraction you get to things that really worms into your brain during your formative years."
EMINEM_4Evah,4,68,Keep it loopy I know u gon keep loopy man
Playtek,4,66,Good news for us spotify users going forward for LP9!
chrislaw,4,59,(What you did there) I saw it
Travisx2112,4,56,"I liked The King of Limbs, but it wasn't my favorite. I can already tell that this album is going to be better than it's predecessor :)"
Mellonote,4,49,"Depression isn't really something that you can just stop suffering from. Sure you can take the pills, change your environment, but it's with you for life."
step_uneasily,4,48,Naawh I know you’re semi serious but it feelsbadman. I think he looks really good nowadays. He was just kinda low-effort in his 40s lol
smokedoor5,4,46,"Us: “I’m going to play the sickest track off of my favorite album”
 
 Them: “Why is this guy spazzing out to a funeral dirge?”"
thosememes,4,38,Probably the single hardest song to dance to released by a popular artist
PrincesuKenny,4,37,"They're not cheering it but they don't stage protests the way they do around Israel. And Saudi Arabia is one of our strongest allies.
 
 But I don't think the anti-Israel rhetoric is due to anti-Semitism. I think it's more that those people need to fit everything into a white colonizer/brown colonized paradigm."
Soulsiren,4,35,">denying the right of the Jewish people to a land which is actual antisemitism
 
 I'm not sure I agree with this. Is it racist to suggest a particular group doesn't have an intrinsic right to some specific piece of land? Who else gets this ""right to a land"" -- which seems to suggest some kind of continuing primacy within that land regardless of demographics etc. Do other nations function in this manner? Indeed, what other nations are specifically tied to ethnic groups in this manner (since you say the right of Jewish rather than Israeli people to land)? The rhetoric seems somewhat unique to Israel. There's a limited amount of land -- what is it that gives a particular group the right to some? What is it that gives them the right to a *specific* piece?"
filopaa1990,4,35,"""News"" am I right"
Theodore_Buckland_,4,34,Holy shit and their goal was to return that kid to his family
crichmond77,4,32,"I feel like having TKOL above The Bends and AMSP is the ""harsh"" part, if anything.
 
 Since when does anyone question whether The Bends is great? That's when Radiohead started being Radiohead."
coacheez,4,31,I'm a huge Radiohead fan and I also enjoy a good bigmac
K-leb25,4,30,"Oh, I thought he was just talking about farts."
SpencerPorter,4,28,"yeah, screw you, guy!"
Stargirl_Shay,4,28,I’m telling you I’d straight up d i e
trilliamortiz,4,27,"This answer is trash. A cultural boycott is there to pressure that government to stop their policies. Israel through multiple administrations has continue the same policy of occupation. You refuse to visit and play concerts at country that has a large record of human rights violations. Artists united against apartheid was a cultural boycott that included people like Bob Dylan that refused to play in South Africa. BDS calls for artists to not play in Israel. Its that simple. If you refuse to join the boycott, then explain why. Dont make up a bad excuse like this."
JRDN7,4,26,"For me, 
 1. Kid A 
 2. In Rainbows 
 3. OK Computer 
 4. Amnesiac 
 5. Hail To The Thief 
 6. The King Of Limbs 
 7. The Bends 
 8. A Moon Shaped Pool 
 9. Pablo Honey"
NobozMopoz,4,20,Ok good? I just thought that because there is one lingering around here. This image has been reposted quite a substantial amount of times so that's how I came into that conclusion.
jalapina,4,18,"Hahaha that's where I took it from, I thought of Thm as soon as I saw that."
NothingToDoubt92,4,17,I know he was married to Rachel for half of his life... could be referencing that
mikethehuman,4,12,"How to tell my mom that the Mother's Day celebration has to end at 1pm my time so I can soak in this album before Game Of Thrones starts... Priorities mom, sorry!!"
DLD493v2,4,11,"10/10
 
 100/100
 
 Best comment.
 
 BEST COMMENT."
scrantonic1ty,4,10,Those reversed strings at the end are fucking genius. Sounds as if Jonny will be towering over this record like nothing they've ever done.
Rereloco,4,10,"20.
 
 1. Ok Computer
 2. Kid A
 3. In Rainbows
 4. A Moon Shaped Pool
 5. The Bends
 6. Amnesiac
 7. Hail to the Thief
 8. The King Of Limbs
 9. Pablo Honey"
EkkoThruTime,4,9,[POV: You play Pablo Honey](https://i.kym-cdn.com/entries/icons/original/000/033/028/girls.jpg)
aahxzen,4,8,"Preach it, Thom"
2Legit2Quiz,4,7,"The Bends is a classic, I don't understand how most fans rank it so low."
threefingersplease,4,6,You bet!!
rickest_rick_,4,6,"The things everyone thinks are so hard or so amazing are always the easiest things to do on an instrument. Not talking shit, but it’s always funny to me."
CatConfectionary,4,5,Where did you hear that? There's tons of videos of him playing different parts with each hand.
sanfran47,4,5,That’s the perfect way to describe it. Thank you for finding the words.
JustinGitelmanMusic,4,4,"Kid A is the best album of all time. 
 
 Great meme, especially because I have no idea why anybody says In Rainbows is their #1. It’s very good but just doesn’t stand out as an icon and among greatest albums of all time in the way Kid A and even Ok Computer do."
Qf3ck3r,4,2,"Not a fan of the group no, just some of their songs. Loved how they were used in Father Ted though. 1998 and it hit the nail square on its head."
JimAdlerJTV,3,5131,You know it's serious when Thom is typing in complete sentences
jooohnny32,3,1255,"I must admit, this is much better than I expected."
JFeldhaus,3,1146,"The point about Trump is good, why is nobody of these holier than thou journalist calling for a cultural boycott of the US? Oh because many of them are actually American? 
 
 EDIT: I think I've hit a sore spot for some <3"
Rocket_McGrain,3,1063,KILLING ME WON'T BRING BACK YOUR GOD DAMN PABLO HONEY.
Pak-O,3,991,"May 8th is the day, people."
identikitistheshit,3,830,"sad thing is, i know this is absolutely true because i seriously cannot ask for ketchup at mcdonald's."
jjysoserious,3,799,you are the chosen one
IBeBallinOutaControl,3,439,I have mixed feelings on the boycott but the idea that it is nothing but antisemitism is utter bullshit. You should know that this argument honestly looks like a cheap and hollow version of playing the race card to most people.
meltedlaundry,3,360,Depressing Music =/= Bad Music
MrChopinn,3,353,"""Dad, why Is my sister named Julia?""
 
 ""Because its ur mother favorite song""
 
 ""Ohh, so that's why my name is let down, I was named after Radiohead's song, right?""
 
 ""What's Radiohead?"""
niklz,3,329,[S C R O B B L E S](https://www.youtube.com/watch?v=Gmomcik_S5o&list=PLDYwEZsGJFT-hxlOuqjWNUIFdoAeY3Oae)
SpacemasterTom,3,290,"*No problem, Nude*"
NickDav14,3,286,"My attempt at the lyrics:
 
 
 Dreamers
 
 They never learn (x2)
 
 Beyond the point
 
 Of no return (x2)
 
 It is too late
 
 The damage is done (x2)
 
  __amazing music interlude__
 
 This goes
 
 Beyond me
 
 Beyond you
 
 The white room
 
 By a window
 
 Where the sun comes through
 
 We are
 
 Just happy to serve
 
 Just happy to serve... you
 
 
 What happens now? (I've found my love) (x3)(?)
 
 EDIT: Thanks to /u/MrDowntempo who has a better ear than me and to /u/DiamondsInTheDust who knows his shit."
soytendies,3,279,Didn't have to go that far either.. Thom is vegan and plays at stadiums serving all sorts of garbage..
mbk-ultra,3,278,He’s almost as intelligible as Thom when he sings.
aboyandhisjadons,3,260,Thom was fucking right
reap_what_you_sow,3,230,"https://soundcloud.com/jgggggggg/radiohead-daydreaming-outro-reversed
 
 I cleaned it up really quickly and pitched it up an octave. It sounds like he's saying ""half of my love.""
 
 edit: i got a copyright infringement email."
thayslan,3,223,I can't imagine how fucked up it would be if radiohead didn't come to my country because of my government
content_has_shifted,3,209,"""But change the opacity slowly, it'll probably be less obvious"""
junkimchi,3,209,"1. Kid A
 2. Ok Computer
 3. In Rainbows
 
 &#x200B;
 
 This is the order"
meltphace26,3,192,Ed is bird
BaroTheMadman,3,191,"""Guys we had already completed this album years ago but gosh darn claymation takes bloody long to make"" ~thm"
CrazyPurpleBacon,3,185,"What's that from?
 
 edit: Lol"
SkilledB,3,178,Is that the one town in the world where everyone thinks Pablo Honey was the magnum opus of Radiohead?
SeniorSophomore,3,161,[Beautiful.](http://i.imgur.com/Tcd0qvZ.jpg)
sox8910,3,158,"Remember Hunting bears is a cover, though"
autienne,3,143,Wow I actually laughed so loud. It's perfect. Plus the fact that it's trending? Beautiful.
selloboy,3,132,Radiohead doesn’t exactly fit a partying vibe
preemptive_strike23,3,120,Same. Idioteque is my favorite track they've done. Really amazing how they can do both though
Rhino-fight,3,111,What does it matter? They probably stole it from Coldplay anyway.
